Primary_Strategy,Expected_MOIC_Gross,Target_IRR_Net,Investment_Period_Years,Fund_Life_Years,NAV_Initial_Qtr_Depreciation,NAV_Initial_Depreciation_Qtrs,J_Curve_Description,Modeling_Rationale
Venture Capital,2.75,0.22,5,12,-0.0150,8,"Deep Initial Drop","High-risk, long-gestation assets. Deep J-Curve expected (-1.5% Qtrly for 8 Qtrs)."
Private Equity,1.85,0.16,6,10,-0.0050,6,"Moderate Drop","Standard J-Curve dip due to fees and transaction costs (-0.5% Qtrly for 6 Qtrs)."
Real Estate,1.60,0.13,5,10,-0.0010,4,"Shallow Initial Drop","Minimal J-Curve, offset by early income/yield (-0.1% Qtrly for 4 Qtrs)."
Infrastructure,1.50,0.10,7,15,-0.0001,2,"Negligible Drop","Very stable assets; virtually no J-Curve (-0.01% Qtrly for 2 Qtrs)."
Private Credit,1.35,0.09,4,7,0.0000,0,"No J-Curve (Flat)","Primarily debt payments; capital is returned quickly, not relying on equity exit."
Secondaries,1.70,0.14,2,8,-0.0030,3,"Accelerated Shallow Drop","Acquiring mature portfolios accelerates distributions and minimizes the initial J-Curve dip."
Fund of Funds (FoF),1.65,0.13,5,12,-0.0040,5,"Moderate Drop (Smoothed)","Diversification across multiple underlying funds smooths out J-Curve volatility."
Co-Investment,1.80,0.15,4,9,-0.0060,7,"Lumpy Drop","Deployment is tied directly to opportunistic deal flow, leading to more volatile but short-lived initial drops."
Real Assets,1.65,0.11,5,15,-0.0015,4,"Shallow Drop","Tangible assets with periodic yield; stable valuation."